{
  "artifact_type": "drift-observation",
  "observation_id": "DRIFT-RUN01",
  "run_id": "RUN01",
  "asset_or_clip_id": "ASSET-OR-CLIP-01",
  "expected_state_snapshot_sha256": "0000000000000000000000000000000000000000000000000000000000000000",
  "expected_visual_projection_sha256": "0000000000000000000000000000000000000000000000000000000000000000",
  "symptom": "Describe the directly observed visible or audible drift in the preserved output.",
  "time_range": null,
  "evidence": [
    {}
  ],
  "scope": {},
  "recommended_owner": "human-canon",
  "proposed_mitigation": "Describe the smallest scoped production change that can be tested in the next exact submission.",
  "canon_change_proposed": false,
  "drift_observation_sha256": "0000000000000000000000000000000000000000000000000000000000000000"
}
